tweet id,user id,username,content,sentiment,target,annotator id,comment,dispute
10037191189,52461517,HailGalvatron,Rockefeller: Stupak Has To Decide If He Wants To Bring Down Health Care http://is.gd/9LDRF #p2 #hcr #StopStupak, neutral, hcr,nnaz
9985629756,16082787,slackadjuster,RT @HypocriticOath: @clairecmc 35 Senators now support #publicoption through reconciliation. WHY ARE YOU SILENT? WEneed leadership! #hcr #p2,negative, liberals,nnaz
9996194413,18058317,ccoalition,"House, Senate Dems split on health care tactics (what to do?, what to do?) http://is.gd/9Gxrq #tcot #hcr",negative,hcr,nnaz
9999850099,29350302,secularstupiddd,RT @CSteven Join CODE RED http://bit.ly/c194CE & STOP the Dems #hcr bill #cbiz #tcot #ocra #sgp #teaparty #iamthemob #ucot #startover,negative, dems,nnaz
10012028336,34761747,stevekimura,"RT @dksithlord: Hey stupak. you STILL don't get it. it's the woman's decision, not the effin' govt's. #tcot #p2 #prochoice #hcr #stopstupASS",negative, other,nnaz
10029019463,16274815,reimagin,STOP #OBAMACARE TARGET=VOTE OUT 12 VULNERABLE DEMS Bill Foster (202) 225-2976 630-406-1145 #killthebill  OR GO! #hcr #tcot,negative,obama,nnaz
10042366994,34761747,stevekimura,RT @Karoli: This is why the WH isn't supporting the #publicoption as strongly. as much policy as budget. http://bit.ly/aY6qwt #GOPbites #hcr,negative, other,nnaz
9969657356,113450071,LibbyLefty,We need TRUE #HCR. Call Sen.Akaka 202-224-6361and tell him to support the #PublicOption thru Reconcilition. #p2,positive, hcr,nnaz
9975250118,76944720,RFNovotny,Affordable Health Care\nCommon Sense\nhttp://is.gd/9b7br #tcot #politics #conservative #p2 #hcr #dnc #dems,positive,conservatives,nnaz
9992849922,55329156,RNCResearch,"Obama wants #hcr to have same kind of up-or-down vote that was cast on welfare reform, CHIP, COBRA, & Bush Tax Cuts http://bit.ly/cDodua ...",positive,obama,nnaz
10002153867,21044127,BluegrassPundit,Obama tries to comfort House liberals with hopes of public options to come: http://bit.ly/abfhwI #tcot #gop #sgp #hcr,positive,obama,nnaz
10028247666,25334080,BenefitsSelling,Top 10 peeopls who could make or break #hcr:  http://bit.ly/cNPb4G,positive, hcr,nnaz
10041992448,23352319,devingriggs,We have 35 Senators on record in support of a #PO through reconciliation. We only need 15 more (plus Biden)! #hcr #p2 #topprog #tcot,positive, other,nnaz
9983518840,15232705,Degringolade,Public Option Picks Up 35th Supporter http://retwt.me/1Mo3O #hcr,neutral, other,nnaz
9984267349,22643800,hipEchik,Ronald Reagan On Socialized Medicine 1961 : http://tinyurl.com/mqtuoq MUST Listen #tcot #hcr,negative,hcr,nnaz
10028191691,19732044,CatholicEditor,Urgent video message re:Obamacare http://bit.ly/96lSCp #prolife #catholic #christian #hcr #teaparty #tcot #tlot #sgp #liberty #freedom #gop,negative,hcr,nnaz
10339515466,108437634,RedDogReport,"f you do not call Congress today, you cannot complain when the #hcr bill is passed. Call Now!(202)224-3121 #tcot #teaparty", negative, hcr,nweaver
10374545790,30858943,Nitwhit19,"Dr.Obama postpones Asia trip, wants to stay home and play proctologist with  #hcr. WETHEPEOPLE WILL NEVER BEND OVER FOR THIS-SEE YOU IN DC.", negative,obama,nweaver
10409842232,27897429,RollinsWallace,"If I were a Dem Congressman, I'd organize The Conscience Coalition to vote NO. By any reasonable moral standard, this #HCR is unconscionable", negative, hcr,nweaver
10410938349,50763777,tbmedicine,"Code Red Rally To Kill the Bill, Capitol Hill, March 16th http://ff.im/-hqF0t #handsoff #hcr #healthreform #healthcare", negative, hcr,nweaver
10428294460,21541548,andilinks,When the Democrats are cloudy with #hcr their stupidity rains on everyone.  @KMers @socooked @MWM4444 #p2 #tcot #tlot #sgp, negative, dems,nweaver
10428630275,57005769,PatriotAirborne,RT @fleckman: 15 Reasons why ObamaCare is an object failure via @IBDeditorials  http://bit.ly/cC88Mv #tcot #tlot #hcr #p2, negative, hcr,nweaver,"target could also be Obama with the use of ""ObamaCare"""
10442299667,18365568,rochtrev,RT @several_: RT @catawu: Krugman Blows away the HCR myths... Even #tcots should be able to comprehend this: http://nyti.ms/9hgecX #p2 #hcr, negative,conservatives,nweaver
10443243715,77562646,Fla67,DEMOCRATS on film admit their dishonesty re #hcr http://bit.ly/94DPwN @SenBiIINELSON @senbennelson @JimOberstar @GregWHoward @CSteven #tcot, negative, dems,nweaver
10341465450,64592901,jake1822,"RT @MelissaTweets: BREAKING: 3 Dems - Berry, Bishop, and Giffords To Switch From ''Yes'' To ''No'' to #hcr http://ow.ly/1hmz8", neutral, dems,nweaver,positive or negative depending on reader's view
10348600414,23696410,BrentTeichman,THIS is a defining moment in American history. Find & email your Congressman on #hcr right here -> http://bit.ly/bHKdoo #tcot #sgp #teaparty, neutral, hcr,nweaver,neutral tweet but tags are conservative
10329850940,16082787,slackadjuster,"RT @TerresaS:  Henry Aaron, David Cutler, Alice Rivlin, et al: #hcr bill is crucial to reducing deficit (PDF): http://bit.ly/cAf35l",positive,hcr,nweaver
10334371722,16434558,LyndaOFA,Support for #HCR rising: http://bit.ly/blsOYB #OFA #p2,positive,hcr,nweaver,"could possibly be neutral, or negative depending on the targeted audience, but seems positive "
10335951096,15000848,cece248,"CBO reports Senate Health Bill Would Cut Deficit By $118 Billion. http://bit.ly/bFIxF5 Guys & gals, I think we got ourselves a bill! #hcr",positive,hcr,nweaver
10336291837,980611,Karoli,83% of MoveOn's 5 million Members support passing the damn bill. I view that as an overwhelming majority. #hcr #ptdb,positive,hcr,nweaver,"use of 'damn' seems negative, but tags and having a majority is positive"
10338317329,46985065,tickle_b,Final March Day 2: Call Congress  http://bit.ly/cTuLEV  #p2 #HCR #OFA #passthedamnbill,positive, hcr,nweaver,"neutral tweet, but positive tag"
10339084846,18862302,mariopiperni,Elitist libruls want your loved ones to live. Say no! http://twurl.nl/fus0i8 #hc #hcr,positive, liberals,nweaver,sarcasm
10344351470,42363794,sqeptiq,"I support passing the Senate #hcr bill but I'm also pro-honesty, & a #publicoption is EXTREMELY unlikely in this Congress. #hc10 #po #p2",positive, hcr,nweaver
10408371485,65785383,blackjedi47,@ConservativeInd Time to pass #HCR and relegate the #GOP to history where they feel most Comfortable-living in the past. #tcot #p2,positive, hcr,nweaver,could be sarcasm
10434978368,122744919,sonny708,The public option is now up to Pelosi -- tell her to pass it! http://bit.ly/dpuhhs @BoldProgressive #p2 #hcr,positive, hcr,nweaver
10440331957,16500945,dmooney9,Look. We finally have a President who cares less for politics and re election than he does about doing what's right.  #hcr,positive,obama,nweaver
10105170136,16469463,CFHeather,RT @jeffbassell: RT @TriciaNC1: Riddle me this: If 37 States putting in laws to protect from #Obama #hcr how will it be paid for? It can't.,negative,hcr,snuon
10124922629,39169522,OldeCountry,Daschle and McCanne: Incremental Health Reforms Won't Work | Physicians for a National Health Program: http://bit.ly/9tkpe4 #tcot #p2 #hcr,negative,hcr,snuon
10132436187,24018771,Ramotringo,"Though #hcr is on for over 50 yrs plus 1, #GOP still insist Prez Obama should: ''Scrap the Bill, start over''... NB The urgency of now!! #tcot",negative,hcr,snuon
10101987109,22217443,cat_1012000,RT @Loxodonta_s RT @STXherry: Our Country's Future In Two Weeks http://is.gd/9R9eE #ucot #tlot #healthreform #HealthCare #hcr #sgp,neutral,hcr,snuon
10104744293,16474992,winterthur,RT @avivao: How  current #HCR proposals would save #Medicare money by restructuring: #p2 http://bit.ly/aQyGsH #p2 #tcot RT.@maggiemahar,neutral,hcr,snuon
10115722587,21329783,stunetii,RT @iranangel: #iranelection List of worldwide events Mar 8 International Women's Day http://bit.ly/7ULcnr #IWD #iran #HumanRights,neutral,other,snuon
10136390372,17636414,danielsaudade,Comparison of Healthcare Systems in the Industrial World http://bit.ly/amCXIa #hcr #Gt #p2 #tcot #teaparty,neutral,hcr,snuon
10108098658,15774048,RayBeckerman,RT @BrainyGurl: Last Chance. Stand up for women in #HCR. http://bit.ly/dD2glu #p2,positive,hcr,snuon
10111771545,106630088,GOTVote2010,VOTE Earl Blumenauer for #OR03! Follow @repblumenauer & GOTV #p2 #hcr #topprog #Oregon #OR #ORdems #OFA,positive,dems,snuon
10111987103,87313007,DCSoljaGurl,McClatchy Survey Finds 2 To 1 Support For Health Care Reform http://bit.ly/cmZtmB  2 to 1! #maddow #hcr #DemWarRoom #WeGotEd #cnn #GOPliars,positive,hcr,snuon
10112020416,106630088,GOTVote2010,VOTE R.T. Rybak for #MN Governor! Follow @MayorRTRybak & GOTV #p2 #topprog #hcr #MNdems #MNgov #dems #OFA,positive,dems,snuon
10112108535,106630088,GOTVote2010,VOTE Alexi Giannoulias for Senate! Follow @Alexi4Illinois & GOTV #p2 #hcr #ILSen #IL #ILdems #chicago #topprog #OFA,positive,dems,snuon
10112354278,106630088,GOTVote2010,VOTE Bill White for Governor of #Texas! Follow @billwhitefortx & GOTV #p2 #TX #TXDems #hcr #topprog @TX4BillWhite,positive,dems,snuon
10112804838,106630088,GOTVote2010,VOTE Michael Bennet for Senate! Follow @BennetForCO & GOTV #p2 #COSen #topprog #Colorado #CO #HCR #CODems #OFA,positive,dems,snuon
10113440838,106630088,GOTVote2010,VOTE Bill Halter for Senate! Follow @BillHalter & GOTV! #p2 #AR #Arkansas #ARSen #ARdems #HCR #topprog #OFA,positive,dems,snuon
10129883818,82232226,CrankyPuebloan,How Healthcare Got Its Mojo Back | Mother Jones http://bit.ly/dbbpLr #hcr,positive,hcr,snuon
10132667040,7619982,davidbadash,"@Aubs89 I'm convinced something is better than nothing. If #HCR fails, more people will die, more will go bankrupt. It's a start.",positive,hcr,snuon
10139130243,16474992,winterthur,Mark Begich open to reconciliation for health reform--that makes 50 without any maybes: http://bit.ly/9cvzIQ #hcr  #hcs,positive,hcr,snuon
10124086613,23934422,o_lucky_me,To me the bad news is that #HCR is a placeholder. GOP is frustratd 2 have lost power 2 the first other then white visionary Pres. in history,negative,gop,snuon
10138735177,65535533,carolaIk,RT @RayBeckerman: Healthcare reform march & rally Tues Mar 9th 10:30 am Washington DC #hcr http://bit.ly/bveSCY,neutral,hcr,snuon
10053921552,21450142,DOMINICDADAMO,Rep. John Adler #NJ It is time vote with Reason on #HealthCare Reform it is Time to pass the Bill #p2 #hcr,positive,hcr,speriosu
10054451485,23825051,webmiss007,RT @pamsez @Nanmac3109: Stupak = Liar being paid to stop #hcr. Thank you for exposing him @maddow,negative,gop,speriosu
10056649820,17563566,ravianandyes,@SenatorHagan Please keep working to finish comprehensive health reform http://bit.ly/r2eoE #hcr #NC #28277,positive,hcr,speriosu
10059163101,16474992,winterthur,MUST WATCH:The Truth About #Republicans by George Carlin: http://bit.ly/96DUv4 #hcr #hcs #p2 #tcot,negative,gop,speriosu
10072926087,56167383,usvoteout,``Concentrated power is not rendered harmless by the good intentions of those who create it.''MFriedman #tcot #socialism #hcr,negative,liberals,speriosu
10074783718,16305494,tlw3,"RT @almostdorothy: ppl lk Obamacare. Its only neo conservatives, corporate socialists & teaparty communists who oppose it. #tcot #hcr #p2",negative,conservatives,speriosu
10074947182,23013878,Mick4Liberty,LevinTears A Liberal to Pieces http://youtu.be/bVmvZa-G4Fk #tcot #tlot #TPP #teaparty #iamthemob #ucot #military #summit #hcr #ga12 #p2 #dem,negative,liberals,speriosu
10076523398,7713202,GOPLeader,(VIDEO) Rep. Parker Griffith (R-AL) Delivers Weekly GOP Address on #hcr http://bit.ly/dgwg3J,neutral,gop,speriosu
10077598554,72552866,USRealityCheck,"Pilots rally around JFK controller: NEW YORK, March 6 (UPI) --  Pilots are showing support for the New York air... http://bit.ly/a42BwS utn",neutral,other,speriosu
10078032158,59026330,gnunews,The Rachel Maddow Show: Republicans Go `Nuclear' with Health Care Reform Lies http://is.gd/9wYVQ #p2 #hcr,negative,gop,speriosu
10053210603,15182798,thejoshuablog,RT @winterthur Did secretive religious group subsidize #BartStupak's rent? http://bit.ly/93QkEB #hcr #hcs #religion #congress,negative,liberals,squeak
10053886293,113450071,LibbyLefty,We need TRUE #HCR. Call Sen.Conrad 202-224-2043 and tell him to support the #PublicOption thru Reconcilition. #p2,positive,hcr,squeak
10053953664,57005769,PatriotAirborne,Obama vs. Insurers and the People'' http://bit.ly/anViYq #tcot  #hcr <GOOD READ,negative,obama,squeak
10057824029,24733117,jilevin,Let them eat applesauce: Right-wing #media mock the uninsured: http://bit.ly/c9FdPF #hcr #p2 #topprogs #journalism,negative,hcr,squeak
10059031479,16474992,winterthur,"MT @stockmarketscam: You know, of course, that the #Bush family holds the patent on population control, google eugenics, Bush #hcr",negative,conservatives,squeak
10061933291,16474992,winterthur,MT @ColoradoHealth: Goldman Report: health insurers will raise prices t/ B sure to check what #GoldmanSachs is shorting! #hcr,negative,hcr,squeak
10071482981,15814268,Lrhicks,RT @novenator: Stewart Mocks GOP for Invoking Rapture to stop Healthcare http://digg.com/d31Kk79 #p2 #hcr on @politicususa,negative,gop,squeak
10076046622,24405200,Marnus3,Bart Stupak should consider giving up lying for lent. #p2 #hcr #ACORN,negative,liberals,squeak
10078427587,83949216,TriciaNC1,CBO says #Obama wrong on how much his deficits will be. A MUST read.  http://bit.ly/bSqtTZ #gop #tcot #teaparty #iamthemob #sgp #hcr,negative,obama,squeak
10078758212,18478452,FutureDocs,WSJ.com - Obama: Congress 'Must Act Now' On Health Care Bill http://on.wsj.com/bn9PNW #hcr,neutral,hcr,squeak
10082210680,15359014,OKCliberal,AP: Obama Turns Up The Heat For Health Care Overhaul: http://tinyurl.com/ya5oynt #p2 #hcr #hc10 #topprog #dnc,neutral,hcr,squeak
10083131674,15950463,christinakb,Just saw someone call the Coffee Party thing ''the Coffee Drips'' ~ LOL! #teaparty #tcot #sgp #hcr #th2dc,negative,liberals,squeak
10083159385,30313925,whitehouse,RT @PressSec: Start over?! Here's why ins cos want us 2 walk away from #hcr & why the Pres wants them held accountable http://bit.ly/9uDTMn,positive,hcr,squeak
10084768502,107778837,BrainyGurl,Last Chance. Stand up for women in #HCR. http://bit.ly/dD2glu #p2,positive,hcr,squeak
10085608020,11252962,ashong,I don't think people can have a right w/o some responsibility.'' - Lisa from Iowa #hcr #TheDNAx,negative,hcr,squeak
10086971195,91279573,adamsbaldwin,Malignant Narcissists (''Mal Nars'') of the World Unite! - http://bit.ly/5Z8L8A (h/t @HeyTammyBruce ) #HCR #tcot #CongressionalNihilism,positive,other,squeak
10087027780,21954033,SgBz,Half of those opposed to #hcr is because it doesn't go far enough #pX #tcot http://bit.ly/aC62yq Support is 2 to 1,positive,hcr,squeak
10088097596,37080099,jackiesic,RT @JimDeMint President's modest changes to his health care takeover are like pouring a glass of fresh water into a polluted lake. #hcr,negative,hcr,squeak
10253786986,19430999,KING5Seattle,11-year-old Seattle boy goes to DC to testify for health care reform: http://bit.ly/9nlQBV  #hcr,neutral,hcr,squeak
10256483746,24733117,jilevin,Palin Admits To Travelling To Canada For Health Care http://bit.ly/9385Sw #p2 #topprogs #hcr #tcot #tlot,negative,gop,squeak
10259474425,15511055,avivao,Voluntary end-of-life measures are banned at Catholic hospitals (NYTimes) http://3.ly/taIz #p2 #hcr,neutral,other,squeak
10329853264,46985065,tickle_b,Obama Will Triumph - So Will America   http://bit.ly/7i9L0F  #OFA #P2 #HCR,positive,obama,squeak
10341131861,35773039,Atlantic_Online,Did you know that student loan reform is holding up #hcr? http://ow.ly/1hlP3,neutral,hcr,squeak
10343491424,16837019,moanasaves,Hope is faith holding out its hand in the dark.  ~George Iles #hcr,neutral,other,squeak
10344172667,34842246,MissAmericaPie,Omg!LISTEN! RTCSteven: Pelosi is attempting TYRANNY! Trying 2 pass #hcr W/O VOTES! Listen 2 Mark Levin NOW http://bit.ly/E0f2G #cbiz #tc ...,negative,liberals,squeak
10382149794,24405200,Marnus3,Palin will testify in the email hacking case next month. The court has refused her 100k speaking fee. #p2 #hcr #ACORN,negative,gop,squeak
10503149272,35690570,SalvatorePar,@WAKE UP NANCY PELOSI! THE SENATE HAS GOT YOUR BACK! 51 VOTES ARE THERE FOR A #PUBLICOPTION in #HCR http://bit.ly/aM3fR4,positive,hcr,squeak
10519534680,30313925,whitehouse,On tap: Watch the President live in Ohio on #hcr at 1:05PM EST. http://www.wh.gov/live,neutral,other,squeak
10519914433,55421408,SenateDoctors,Hot Air: ''Obama flip-flops on dealmaking for ObamaCare'' http://bit.ly/bSvqBs #hcr #tcot,negative,obama,squeak
10527277601,19500327,willmckinley,"Obama gives his most impassioned speech on #hcr. You convinced us, like, six months ago. Now stop talking and get it done.",positive,hcr,squeak
10527580130,11740672,TavernWench,"Why, I believe I'm feeling a bit fired up.  A bit ready to go! #HCR",positive ,hcr,squeak
10528621223,80415454,LtlRedX,RT @Marnus3 Unfortunately for Michele Bachmann her lobotomy is not reversible. #p2 #hcr #ACORN,negative,gop,squeak
10530995251,32517594,RonSupportsYou,RT @Marnus3 Sarah Palin wants ppl to stiffen their spine against #hcr. This from the spineless half governor who slithered away from office.,negative,gop,squeak
10531323232,27618505,genjunky,"OBAMA AND PELOSI, YOU'RE PLAYING WITH FIRE AND YOU'RE GONNA GET BURNED!  #tcot #ocra #teaparty #iamthemob #beck #conservative #sgp #hcr",negative,dems,squeak
10532646283,55018701,EvanGlassCNN,"Speaker Nancy Pelosi just reaffirmed her confidence in #hcr passage: ''When we bring the bill to the floor, we will have the votes.''",positive,dems,squeak
10568957122,58845769,pauline_ma,Switched vote from no to yes on HC Altmire PA (202)225-2565.\n#tcot #tlot #hcr #teaparty #sgp #gop #ocra #iamthemob,neutral,hcr,squeak
10569000612,58845769,pauline_ma,Changed vote from no to yes on HC Boccieri OH (202) 225-3876. #tcot #tlot #hcr #teaparty #sgp #gop #ocra #iamthemob,neutral,hcr,squeak
10571076898,20243128,BrentBozell,"For once, the @WashingtonPost has it EXACTLY right about Pelosi's abuse of power. http://ow.ly/1mQOT #tcot #hcr",negative,dems,squeak
10571342247,76944720,RFNovotny,I don't care where U stand on HCR U cannot let Pelosi get away w/ these tactics. It is just a wrong way 2 govern. #tcot #teaparty #p2 #hcr,negative,dems,squeak
10571345258,15976697,michellemalkin,Making their voices heard: Protesting Demcare on Capitol Hill http://is.gd/aKzM6 #teaparty #hcr #wreckonciliation,negative,dems,squeak
10574026962,7713202,GOPLeader,House Republicans will force vote this week on resolution to stop Ds from implementing the ''Slaughter Solution'' #hcr,negative,dems,squeak
10574396884,53487798,beesnguns,"Under Pressure. Call/Fax Rep. John Spratt, South Carolina 5th http://thegrassrootsamerican.com/?p=572 #south carolina #healthcare #hcr",neutral,other,squeak
10604930286,18351671,KMBReferee,"oh, I saw how Dems are now trying to use children to tell sob stories in order to change public opinion about #hcr. Won't work. #tcot #p2",negative,dems,squeak
10606525807,21707592,exposeliberals,"120,000 to 700,000 jobs will be LOST by 2019 if ObamaARE passes! http://is.gd/aLoYf #tcot #tlot #sgp #hhrs #ocra #hcr",negative,obama,squeak
10618960246,21274455,VOTEDEM,Rep. Debbie Wasserman Schultz on CNBC's Squawk Box at 8:40am re: #hcr #topprog #tlot #p2,neutral,other,squeak
10639413350,75139010,lilleth71,***CALL these 6 Congressmen. They look like they r going toward firm NO. Lets help them! #KILLBILL #hcr (cont) http://tl.gd/hle68,negative,hcr,squeak
10639690812,39660906,beththornton1,"Congressmen, you signed an OATH to support the CONSTITUTION! If you vote for Slaughter Rule you will commit treason to God and country. #hcr",negative,hcr,squeak
10651506029,26918145,midlifechick,"RT @Dewarsplz: Remember folks, if they can 'deem ' #hcr  into law they can also 'deem' to outlaw your guns! Don't let freedom be lost!",negative,liberals,squeak
10651681876,16472571,sunshineejc,"#BillMaher: ''How come Health Care has 2 B deficit neutral, but war in Afghanistan doesn't?''--Why IS that?''-#tlot #p2 #sgp #hcr #gop #topprog",negative,gop,squeak
10651751500,34973389,WorkingMotherHJ,#hcr kids w/ #cancer can survive but they will always have a pre-existing condition.  Should that be the case? #kickcancer #hcr,positive,hcr,squeak
10654068609,83088093,CarltonPurvis,Im tweeting this again because I think its important enough too: http://tinyurl.com/lxj33n #healthcare #obamacare #hcr @nytimes,neutral,hcr,squeak
10654097519,23970626,Hunter7Taylor,"While we're distracted w/#hcr,  Graham, Kerry & Lieberman are finalizing the Senate version of Cap-n-Trade: http://bit.ly/bcaVvi #tcot #tlot",negative,dems,squeak
10654658480,107633302,GeeekGirl,RT @heirsinhope: Michelle Bachmann on killing the bill http://bit.ly/cfkSPH Watch & RT Plz #hcr #ObamaCare #tcot - She's amazing!,positive,gop,squeak
10655504425,105040178,AFPArkansas,ATTN: @Keet4Arkansas  RT @StefaniBuhajla Idaho Gov. signs law against health care overhaul: http://bit.ly/dCiMg4 #HCR @AFPArkansas,neutral,hcr,squeak
10656856286,53487798,beesnguns,"Under Pressure. Call/Fax Rep. Marion Berry, Arkansas 1st http://thegrassrootsamerican.com/?p=438 #arkansas #healthcare #hcr",neutral,other,squeak
10001651951,38886935,MarcyHernick,RT @RepMikePence: [VIDEO] Bottom line: ObamaCare 2.0 is a Govt Takeover of Health Care http://ow.ly/1emof #tcot #healthcare #handsoff #hcr, negative, hcr,sreed
9953672079,14574380,EgbertoWillies,Funny or Die's Presidential Reunion #p2 #tcot #hcr #politics: Barack Obama gets a surprise visit in the night from... http://bit.ly/cmJ1lu,irrelevant,other,sreed,it's an advertisment
10084235928,14173840,ursulas,@myrnatheminx has a beautiful smile! I've seen it in person now! I know! #nim10,irrelevant,other,sreed,???
9953478849,10733062,RatedRepublican,#whatdoyoucallit when our government ignores the wishes of over 70% of the country? #tcot #tlot #ocra #hcr #hhrs #sgp #p2 #oathkeepers #FBO,negative,hcr,sreed
9954225461,16274815,reimagin,"STOP OBAMA CARE, TARGET=VOTE OUT 12 VULNERABLE DEMS John Spratt (202) 225-5501 (803)327-1114#killthebill OR ELSE! #hcr",negative, gop,sreed
9962479155,29833209,taffastrophe,RT @LiliaEP: America needs Obamacare like Nancy Pelosi needs a Halloween mask. #tcot #tlot #teaparty #hcr #hc #gop #sgp,negative, hcr,sreed,mean simile
9995264122,17918065,SBAList,RT @examinerpolitic: Poll: Voting for Senate bill is suicide for pro-life House Dems http://goo.gl/fb/DP9W #hcr,negative, dems,sreed
9995428243,16781837,vadum,Is trading judgeship for HC vote an impeachable offense? It might be. #hcr #tcot #tlot #iamthemob #vrwc,negative,obama,sreed
9998850730,15959560,dcagle,The Republican Sprint Away From Sanity http://bit.ly/btqlOM #p2 #hcr,negative, gop,sreed
9999815009,21044127,BluegrassPundit,"The more Obama talks about Obamacare, the more unpopular it becomes (video): http://bit.ly/azj4Go v#tcot #hcr #gop #handsoff",negative,obama,sreed
10001823678,16077165,politicaltruths,GOP: Is Fear All They Have Left? #p2 #tcot #hcr:  http://bit.ly/aCsSee,negative,gop,sreed
10007254377,51093789,LiliaEP,"The liberals are asking us to give Obama time. We agree, and think 25 to life would be appropriate. #tcot #tlot #teaparty #Obamacare #hcr",negative, liberals,sreed
10031685672,27502479,GregWHoward,Dems want to ram #HCR thru by Easter.  http://bit.ly/a8bRlN #tcot #ocra #sgp #tlot #hhrs #teaparty #ampat #tyranny,negative, dems,sreed
10237278053,18124275,AboutInsects,"My health ins premiums up %50 over past 2 years, AND they cut my benefits. We need #hcr NOW. So #PasstheDamnBill already!",negative, hcr,sreed,,I believe this is positive towards HCR
9968612604,78156215,AwesomeCapital,Pelosi's task: Preaching to unconverted on health vote: http://www.awesomecapital.com #hcr http://tinyurl.com/yl22v9r,neutral  , hcr,sreed
9953041852,27502479,GregWHoward,Latest from @Beaufort_TParty More Insanity from Obamacare. Good read.  http://bit.ly/cc13Nc #tcot #hcra #ocra #sgp #tlot #hhrs,positive, gop,sreed,"could be negative, but has a positive review"
9997966021,18791763,KarlRove,ICYMI:  Great new site on the ''Code Red'' on Obama's #HCR takeover: NRCC.org/CodeRed/  - be sure to use the #gopcodered hash tag!  #TCOT #SGP,positive, gop,sreed
10000125516,84664241,TCOAmerica,Maybe no health care bill vote by Easter http://bit.ly/bbFVzm #hcr #tcot #tlot #hhrs #ucot #ocra #liberty #patriot #teaparty,positive,conservatives,sreed,maybe negative
10233691334,7231112,jadedfox,RT @mat: Best #HCR argument yet: Urolagnia enthusiast radio host Rush Limbaugh vowed to abandon the USA if it passes: http://bit.ly/ajCc4S,positive, dems,sreed
10237213889,78495596,OFA_WA,Now more than 9 million #OFA hrs pledged to fight for Reps who fight for #HCR http://bit.ly/cGIyBg #p2,positive, hcr,sreed
9940994349,15959560,dcagle,Great cartoon about the GOP's ''plan'' for 2010... http://bit.ly/bz9R1G #p2 #hcr,negative,gop,tdavis
9946057301,24405200,Marnus3,Palin said her day job was in journalism? I thought she was working for Fox news. #p2 #hcr #ACORN,negative,other,tdavis
9947292394,14832751,cboyack,Obama Now Selling Judgeships for Health Care Votes? http://is.gd/9DxQL #tcot #hcr #utpol #c4l #yal (via @nathancoffey),negative,obama,tdavis
9961774950,14389132,nansen,US News & World Report: Obama opposed reconciliation b4 he supported it. #hcr #tcot #sgp http://bit.ly/cMTZMJ,negative,obama,tdavis
9975112784,72552866,USRealityCheck,Palin and entourage `like locusts' at Oscar gift benefit: Former Alaska Gov. Sarah Palin can't get enough o... http://bit.ly/9WcZFQ raw #US,negative,gop,tdavis
9977541511,110185527,AlwaysEpiphany,RT @tlw3: Tsunami Alert! GOP to Unleash Huge Wave of Robocalls Today Against Health Care Vote http://bit.ly/aAEZY4 #hcr #hcs #p2 #tcot,negative,gop,tdavis
9979033977,7713202,GOPLeader,"Sen. Gregg suggests Obama may renege on fixing Senate health bill, jamming House Dems http://bit.ly/b8iGM3 #hcr",negative,obama,tdavis
